{
  "alert_id": "alt_001",
  "machine_id": "M-001",
  "event_id": "evt_001",
  "prediction_id": "pred_001",
  "severity": "CRITICAL",
  "status": "OPEN",
  "risk_score": 0.91,
  "model_version": "maintai-ml-1.0.0",
  "policy_version": "risk-policy-1.0.0",
  "dedupe_key": "M-001:CRITICAL",
  "created_at": "2026-10-15T04:30:15Z",
  "updated_at": "2026-10-15T04:30:15Z"
}
